Problem,Tech,Cost,Time,Regulations,Social Acceptance,Sum Constraints,IQ,QL,Total Impact,Notes
1. Revenue Cycle Complexities,D. Multi-Agent Orchestration,7,6,5,4,22,9,9,81,"- Multiple specialized agents: One for eligibility (EVA in Thoughtful), one for prior auth (PAULA), one for claims mgmt (CAM). They pass data among themselves in real-time, parallelizing tasks.- Ascertain can spin up multiple “virtual employees” for each RCM step."
4. Clinical Documentation Burden,D. Multi-Agent Orchestration,7,6,5,4,22,9,9,81,"- Multiple “doc-generation” agents: one transcribes, another codes, another checks compliance. They pass partial results among themselves in real-time.- E.g. Thoughtful (EVA, PAULA, etc.) or Ascertain “virtual employees” approach."
5. Data Fragmentation & Interoperability,D. Multi-Agent Orchestration,8,6,6,5,25,9,9,81,"- Multi-agent approach: Each system has its specialized “agent” or microservice. They communicate to unify data (like microservices in big tech).- E.g. Ascertain “Unified Agent Framework,” or Beam multi-LLM orchestrations."
1. Revenue Cycle Complexities,A. RPA + Workflow,5,4,4,3,16,8,9,72,"- Automate claim status checks, fill forms, push updates to payers.- Example: Thoughtful AI uses RPA for denial routing (CAM, DAN). Notable similarly uses RPA to accelerate claims."
1. Revenue Cycle Complexities,C. LLM Summaries / NLP,6,5,4,5,20,8,9,72,- Summaries of denial patterns. LLMs detect recurring issues in claims for CFO dashboards.- Notable uses NLP to highlight top denial reasons. Thoughtful uses coding logic to cut errors by 75%.
1. Revenue Cycle Complexities,G. Agentic OS & Compliance,6,5,7,4,22,8,9,72,"- A single “agentic OS” can orchestrate all RCM tasks with compliance logs. E.g. Beam AI for multi-agent concurrency plus security layers, Ascertain for on-prem “UAF.”- Audit trails to satisfy external RCM compliance."
4. Clinical Documentation Burden,C. LLM Summaries / NLP,6,5,4,5,20,9,8,72,"- LLM-based note summarization. E.g. SOAP note generation from transcripts, highlighting ICD/CPT codes for billing.- Thoughtful claims 99% coding accuracy with AI-based logic, Notable offers automated note generation."
5. Data Fragmentation & Interoperability,E. EHR Integration & Deploy.,7,6,6,5,24,9,8,72,"- EHR integration using HL7, FHIR, proprietary APIs. Minimizes data fragmentation. E.g. Notable, Thoughtful, Ascertain mention robust EHR/payer connectors.- Some solutions require on-prem adaptors or an enterprise service bus."
6. Security & Compliance,G. Agentic OS & Compliance,7,5,10,4,26,8,9,72,"- The “Agentic OS” logs every agent action, ensuring a complete audit trail. E.g. Ascertain or Beam talk about full traceability (who did what, when). This meets SOC 2 / HIPAA auditing needs. Automatic policy enforcement for data encryption, anonymization, etc."
1. Revenue Cycle Complexities,E. EHR Integration & Deploy.,6,5,6,4,21,8,8,64,"- Deep EHR + clearinghouse integration. Minimizes rekeying between EHR and claims portals.- Notable, Thoughtful, and Ascertain mention robust connectors to payers & EHR."
3. Fragmented Patient Communication,D. Multi-Agent Orchestration,6,5,4,5,20,8,8,64,"- Several specialized “communication agents” each focusing on a channel: phone, SMS, email. They coordinate to keep conversation context. E.g. Beam AI multi-agent system that can unify data in real-time."
4. Clinical Documentation Burden,E. EHR Integration & Deploy.,6,5,6,5,22,8,8,64,"- Must write final notes into the EHR automatically. The AI agent is integrated behind the scenes for real-time updates. E.g. Notable hooking into Epic, or Beam using RAG from the EHR.- On-prem solutions like Ascertain for local data storage."
4. Clinical Documentation Burden,G. Agentic OS & Compliance,6,5,7,4,22,8,8,64,"- Agentic OS keeps a version history for each note iteration, so errors are easily corrected or audited. If the doc is flagged by compliance, it triggers a workflow. E.g. Ascertain might have a manager override."
5. Data Fragmentation & Interoperability,G. Agentic OS & Compliance,7,5,7,4,23,8,8,64,"- An “Agentic OS” can unify access across multiple data systems, logging all cross-system calls for auditing. E.g. Ascertain or Beam can display agent traffic in a single compliance-friendly console."
6. Security & Compliance,D. Multi-Agent Orchestration,7,6,9,4,26,8,8,64,"- Dedicated “security agent” monitors access, triggers alerts. Another agent addresses compliance updates or new regulations. They coordinate to keep the environment safe.- E.g. “One agent scans for unauthorized data access, another agent automatically revokes access.”"
7. Healthcare Workforce Shortages,D. Multi-Agent Orchestration,6,5,5,4,20,8,8,64,"- Multiple care coordinator agents handle follow‐up calls or screening questionnaires. They escalate only the complex cases to a human. Helps staff shortage. E.g. Ascertain can spin up new “virtual employees” quickly, or Beam multi-agent concurrency."
1. Revenue Cycle Complexities,F. Domain-Specific Logic,4,3,5,3,15,7,8,56,"- CPT/ICD code validation, payer rules knowledge base, track policy changes automatically.- Adonis uses domain logic for predictive analytics, LunaBill focuses on reimbursements."
2. Admin Overload,D. Multi-Agent Orchestration,6,4,4,5,19,8,7,56,"- Multi-agent approach to handle huge appointment volumes (one agent for rescheduling, one for confirmations, etc.). If stuck, escalate to a human.- Beam AI exemplifies multi-LLM orchestration for broad enterprise usage."
2. Admin Overload,E. EHR Integration & Deploy.,5,5,5,5,20,8,7,56,- Real-time scheduling integration with EHR’s appointment module (Epic or Cerner). Minimizes double booking.- Some providers want on-prem scheduling logic for compliance or legacy reasons.
3. Fragmented Patient Communication,B. Conversational AI & Voice,3,3,4,6,16,8,7,56,"- Conversational AI handles FAQs (coverage, directions, hours), triages urgent vs. routine calls. Escalates as needed.- Parakeet excels at inbound/outbound calls (referral mgmt, scheduling). Amelia AI, Cognigy do enterprise contact center."
3. Fragmented Patient Communication,E. EHR Integration & Deploy.,5,5,5,5,20,8,7,56,- EHR integration to log conversation details or changes in patient status. E.g. “Booking a follow-up in the EHR after a phone call.”- Some solutions integrate 3rd-party telephony with the EHR’s messaging system.
3. Fragmented Patient Communication,G. Agentic OS & Compliance,5,4,5,4,18,7,8,56,"- “Agentic OS” enforces patient data privacy & captures all interactions in an auditable log. If a breach or misrouting occurs, the system flags it. E.g. Ascertain or Beam with advanced security watchers."
5. Data Fragmentation & Interoperability,C. LLM Summaries / NLP,5,5,5,4,19,8,7,56,- LLM-based retrieval augmentation (RAG): merges data from multiple siloed sources. E.g. Beam AI touts memory for multi-system context; Ascertain has AI agent that can fetch & unify data across health systems.
6. Security & Compliance,E. EHR Integration & Deploy.,6,5,9,4,24,7,8,56,- On-prem LLM deployments for strict data control. E.g. Ascertain highlights this for enterprise healthcare. Some hospital systems demand local hosting for PHI safety.- Also can use a private cloud with SOC 2 environment.
7. Healthcare Workforce Shortages,B. Conversational AI & Voice,3,2,4,6,15,8,7,56,-Conversational AI can fill roles of call center staff or basic triage. Freed staff can do higher-value interactions or direct patient consults.- E.g. Parakeet or Amelia offload repetitive phone calls.
7. Healthcare Workforce Shortages,C. LLM Summaries / NLP,5,4,4,5,18,7,8,56,"- LLM-based “knowledge assistants” to provide nurse-like instructions for stable or low-risk patient queries (discharge instructions, lifestyle advice). Helps scale staff capacity.- HippocraticAI specifically aims to cover low-risk, non-diagnostic tasks with generative AI."
7. Healthcare Workforce Shortages,G. Agentic OS & Compliance,6,4,7,4,21,7,8,56,- Agentic OS approach ensures “digital hires” comply with nurse workflow standards. Also tracks usage metrics to prove ROI for staffing budgets. E.g. HippocraticAI marketplace approach or Ascertain with performance-based ROI.
1. Revenue Cycle Complexities,B. Conversational AI & Voice,3,4,3,5,15,7,7,49,- Voice bots that call payers for prior auth status or clarifications (reducing hold times & staff calls).- Thoughtful & Parakeet mention voice‐enabled eligibility checks.
2. Admin Overload,A. RPA + Workflow,3,3,2,5,13,7,7,49,"- Bots automatically schedule patients, fill forms, route requests to correct staff queue.- E.g. Notable does mass workflow automation for back-office tasks."
3. Fragmented Patient Communication,A. RPA + Workflow,3,3,3,5,14,7,7,49,- Automated text/email reminders triggered by changes in EHR or scheduling system. Minimizes no-shows.- E.g. Egress Health or Steer Health might handle comms workflows.
4. Clinical Documentation Burden,B. Conversational AI & Voice,5,4,5,5,19,7,7,49,"- Conversational voice scribe for live visits: Agents record encounter & auto-populate notes.- E.g. DeepScribe, Abridge focus on ambient scribing to reduce MD time on data entry."
4. Clinical Documentation Burden,F. Domain-Specific Logic,5,4,5,4,18,7,7,49,"- Understanding of clinical terminologies (SNOMED, LOINC, ICD). Minimizes errors in doc.- E.g. Thoughtful domain logic ensures consistent doc with payer/clinical rules."
5. Data Fragmentation & Interoperability,F. Domain-Specific Logic,6,5,6,3,20,7,7,49,- Must embed domain logic for data mapping or transformations (e.g. “Discharge summary” in one EHR = “Clinical notes” in another). Ensures consistent data usage.
6. Security & Compliance,C. LLM Summaries / NLP,5,5,8,3,21,7,7,49,- LLM-based detection of suspicious activity or anomalies in usage logs—like scanning big logs for keywords or patterns. E.g. “Daily compliance summary.”- Potentially advanced solutions from Beam or Ascertain for log analysis.
7. Healthcare Workforce Shortages,E. EHR Integration & Deploy.,5,4,6,5,20,7,7,49,"- EHR integration ensures these AI “virtual staff” can act in real-time (update a chart, schedule labs, generate patient instructions). Minimizes duplication, allowing small human teams to manage bigger caseloads."
2. Admin Overload,B. Conversational AI & Voice,2,2,3,7,14,6,8,48,"- 24/7 front-desk phone triage & appointment booking.- Parakeet or Cognigy handle inbound calls, gather patient data, direct them to the right clinic."
5. Data Fragmentation & Interoperability,A. RPA + Workflow,5,4,4,3,16,8,6,48,"- RPA bridging older systems lacking APIs (screen scraping). Minimizes manual double‐entry across different EHR, billing, pharmacy.- E.g. Notable or Steer Health for bridging multiple software platforms."
2. Admin Overload,C. LLM Summaries / NLP,5,4,3,4,16,7,6,42,- LLM can summarize staff Slack/email threads to highlight recurring tasks or blockers. Saves manager time.- E.g. A summarizer that shows “top 5 operational issues this week.”
2. Admin Overload,G. Agentic OS & Compliance,5,4,4,4,17,6,7,42,- Orchestrated compliance: track each scheduling action with logs for HIPAA. Agentic OS can unify access controls (only certain roles can see PHI).- Ascertain mentions that “AI agent managers” can assign tasks & see progress in a single compliance-friendly dashboard.
3. Fragmented Patient Communication,C. LLM Summaries / NLP,4,4,3,4,15,7,6,42,"- LLM summarization of patient calls for staff reference. Identifies top patient pain points, frequent questions.- Could combine sentiment analysis for real-time feedback."
4. Clinical Documentation Burden,A. RPA + Workflow,4,3,4,4,15,6,7,42,"- RPA checks EHR for labs, inserts them into discharge forms, so nurses don’t do manual copy/paste.- E.g. Notable automates chart prep."
6. Security & Compliance,F. Domain-Specific Logic,5,4,9,3,21,6,7,42,- Hard-coded domain rules for permissible data flows. Agents can’t share PHI with unauthorized parties. Must handle HIPAA’s minimum necessary standard.
7. Healthcare Workforce Shortages,A. RPA + Workflow,3,3,3,5,14,7,6,42,"- RPA cuts down on mundane staff tasks (inventory checks, routine scheduling), letting staff focus on direct patient care.- E.g. Notable or Steer Health handle back‐office, so nurses do clinical tasks."
3. Fragmented Patient Communication,F. Domain-Specific Logic,4,4,3,3,14,6,6,36,"- Domain rules for patient engagement (e.g. “Follow up every 72 hrs after discharge”), compliance around texting PHI.- E.g. Parakeet ensures HIPAA safe text messaging."
5. Data Fragmentation & Interoperability,B. Conversational AI & Voice,4,4,4,5,17,6,6,36,"- Voice or chat agent can “request data” from different systems in real time if back‐end orchestrations exist.- E.g. Beam AI or Ascertain can query multiple data sources, but must rely on RPA or APIs."
6. Security & Compliance,A. RPA + Workflow,4,3,7,4,18,6,6,36,"- RPA can compile compliance logs, user activity reports daily, or auto-terminate stale credentials.- Minimizes human error in account provisioning.- E.g. Large hospital use cases with Notable or Beam."
6. Security & Compliance,B. Conversational AI & Voice,4,4,8,4,20,6,6,36,- Authenticated voice bots that confirm patient identity with strict protocols. Provide disclaimers about data usage. Securely store call recordings. E.g. Parakeet or Amelia AI implementing HIPAA controls.
7. Healthcare Workforce Shortages,F. Domain-Specific Logic,4,3,5,3,15,6,6,36,"- Domain logic for triage guidelines, nurse protocols, medication reminders, etc. Minimizes risk that the AI “oversteps” clinically. E.g. HippocraticAI uses “constellation architecture” with multiple LLM watchers for safety."
2. Admin Overload,F. Domain-Specific Logic,4,3,3,3,13,5,6,30,"- Must encode facility hours, resource availability, specialist calendars, etc. in domain logic. E.g. “Cardiologist only on Wed.”"